Nummer,Namn,Beskrivning,Behöver,Latitud,Longitud,Involverade,Hur många människor berörs,Mejl,Hemsida,Facebook,Instagram,Twitter,Annan länk,,,,,,,,,,,,,,,
1,3DVerkstan,"Tar fram och distribuerar produkter för sjukvården, senast visiret 3DVFaceShield. Vi har kapacitet att producera 1000 visir per dygn.",,59.3505491,18.0677466,,,info@3dverkstan.se,https://3dverkstan.se/protective-visor/,,,,,,,,,,,,,,,,,,,
2,Giddir AB,,,59.325117,18.071094,6,Samtliga medborgare,,,,,,,,,,,,,,,,,,,,,
3,Vårdoptimeraren,Interaktiv hemsida med förslag på optimalt sätt att flytta IVA-patienter (eller resurser) mellan regioner,Data kring antal IVA-patienter per region och dag. Behöver också riktlinjer kring patienttransporter.,57.6960845,11.9575318,5,"Patienter inlagda på IVA (eller alla som kan bli smittade och inlagda), sjukvårdspersonal",victor.backman@advectas.se,http://vårdoptimeraren.se/,https://www.facebook.com/AdvectasAB/,https://www.instagram.com/advectas/,,https://www.linkedin.com/company/advectas-ab/,,,,,,,,,,,,,,,
4,WeCare,WeCare eHealth - Symptoms Tracker & Shield,,,,,,info@wecareall.eu,www.wecareall.eu,https://www.facebook.com/wecareworld/,https://www.instagram.com/wecareall/,,,,,,,,,,,,,,,,,
5,Blivande,"Producerar utrustning till sjukvården, t.ex. plastförkläden","- Personer som vill hjälpa till
- Åldersbeständig plast (ej återvunnen), 0.035 - 0.1 mm tjock, 2000 mm bred (gärna på dubbelvikt på 1m-rulle).",59.343006,18.116554,>2,,hampus@blivande.com,https://www.facebook.com/Blivande/,https://www.facebook.com/Blivande/,,,,,,,,,,,,,,,,,,
6,Hillsong servicepool,Hjälp för personer som av någon anledning sitter i karantän och inte kan eller vågar gå ut.,Volontärer,59.2753,15.2134,100,alla i karantän,,https://hillsong.com/sv/sweden/servicepool/,,,,,,,,,,,,,,,,,,,
7,2047 Science Center,3D-printar visirhållare tillsammans med regionen,Filament,60.48381,15.422684,4,regionens sjukvårdare,info@2047.nu,https://2047.nu/,https://www.facebook.com/2047-Science-CenterFramtidsmuseet-153421984699965,https://www.instagram.com/2047_science_center/?hl=sv,,,,,,,,,,,,,,,,,
8,Grepit AB,Bygger skyddslådor framtagna för att skydda vårdpersonal vid bland annat intubering.,,65.617833,22.129109,5,Sjukvårdspersonal,contact@grepit.se,https://www.grepit.se/,https://www.facebook.com/grepitab,,,,,,,,,,,,,,,,,,
9,Local Hero Kiruna,Lyfter företag och organisationer genom att dela deras inlägg och uppmana till lokal konsumtion och att fortsätta nyttja våra lokala resurser.,"Följare, tipsare",67.855582,20.226831,,,,https://www.instagram.com/localherokiruna,,https://www.instagram.com/localherokiruna,,,,,,,,,,,,,,,,,
